job_id,company_id,title,description,location,job_type,job_required_experience_type,job_posting_url,company_name
3693060500,11056.0,Senior Information Security Analyst,"Desired Skills and Experience- 5+ years of experience with leading internal and/or external audits with a focus on IT governance and risk. - Experience with developing audit plans and analytical strategies to mature the risk assessment processes. - Experience partnering with various IT & Information security teams to understand key processes risks and controls to inform the audit plan. - Experience performing risk assessment on existing and new infrastructure (Azure) to ensure they meet HIPAA and NIST requirements.- Must be a Certified Information Systems Auditor (CISA) and/or Certified Internal Auditor (CIA).- Must sit in PST, MST or CST - PST PREFERRED.- Bachelor's Degree 
Day to Day Insight Global is seeking a Senior Information Security Analyst for a healthcare client to join the Cyber Security Services department. The client is currently undergoing a large Digital Transformation effort to migrate all their applications to the cloud (Azure) so the primary responsibility of this role is to lead risk-based IT, Information Security and Digital Transformation project audits. This will include developing and leading all audit activities, plans, strategies to mature the risk assessment processes. Finally you will act as a liaison external audit team on compliance and regulatory reviews.","Long Beach, CA",Full-time,Mid-Senior level,https://www.linkedin.com/jobs/view/3693060500/?trk=jobs_biz_prem_srch,Insight Global
3693059002,11056.0,Dynamic 365 Functional Analyst,"Day-to-Day Insight Global is looking for 2 Microsoft Dynamics 365 Finance and Operations Functional Support Analysts for one of their clients. They will be responsible for supporting their end users. They will be part of a business applications management team comprised of developers, testers, and report writers. In this role, they will serve as Business Support Analyst ensuring customer goals are being met.
Role and Responsibilities:• Gather and refine business requirements from stakeholders and Dynamics 365 users.• Proficiency in Microsoft Dynamics 365 is a must.• Conduct ongoing gap analyses to assist the Dynamics 365 product owner in prioritizing development.• Collaborate with stakeholders and developers to design and implement solutions in Dynamics 365 to meet business requirements.• Develop and maintain written and visual documentation of business processes implemented in Dynamics 365.• Assist business in troubleshooting issues as they arrive.• Log issues in the ticketing system and enhancements in DevOps.• Perform end-to-end system testing to ensure the system meets business requirements.• Write test scripts and coordinate user acceptance testing.• Work with team to support workflows in the application.
Must-haves 3 years of Microsoft Dynamics 365 support specifically with Finance and OperationsExperience in Supply chain, inventory management, and or manufacturingGreat communication skills (verbal and written)Excel skills - build out formulas and understand different formulas (multi-level) index with a few matches and lookupsAssisting accounting and validating the informationPlusses: Jet reporting or docentricJet is a tool from Insight software - reporting solutionGrab data from ERP and be able to consolidate informationDocentric word based for creating invoices and form letters, packaging slipsBachelors DegreeFamiliarity with Agile methodology and experience working on Agile scrum teams","Houston, TX",Full-time,Mid-Senior level,https://www.linkedin.com/jobs/view/3693059002/?trk=jobs_biz_prem_srch,Insight Global
3693057157,11056.0,Jira Implementation Specialist,"Insight Global is looking for a JIRA Implementation Specialist to help implement the JIRA software into an existing Microsoft Environment for the state of VA. 
This candidate will be expected to work on-site 2-4 days a week downtown and will have to pay for their daily (or monthly) parking. 
This will be an expected 3 month contract with extensions depending on how each implementation phase rolls out. The implementation phases will revolve around specific groups within IT to help them scope what data needs to be properly configured/integrated in/with JIRA, the delivery of the communication around the data, as well as training the teams on how to use JIRA itself to efficiently track and present project data.","Richmond, VA",Contract,Associate,https://www.linkedin.com/jobs/view/3693057157/?trk=jobs_biz_prem_srch,Insight Global
3693056301,11056.0,System Integration Engineer,"Contract55HR
Overview
- 5+ years of Digital Video experience- 3 to 5 years of experience in Video integration engineering- Must have experience in EC/DNCS and VSRM- 5+ years of Linux- 5+ years of networking- 3+ years of scripting- Great written and verbal communication
Nice to Have
- Prior experience working for Charter
Day-to-Day
On behalf of our customer, we are seeking a Video Integration Engineer that is highly motivated, self-starter who has an aptitude for collaborating, learning, providing value while deploying complicated client solutions. In this role, you will have a passion for developing and executing configuration components for video service delivery and solutions for EC/DNCS and VSRM technology. You will complete decommissioning and implementation activities including troubleshooting deployment issues and integration issues, identifying bugs or feature defects and assisting in validation and testing or products. You will also perform integration of servers, video technology, utilizing scripting skills and follow MOP's. Some travel required to customer locations.","Florida, United States",Full-time,Associate,https://www.linkedin.com/jobs/view/3693056301/?trk=jobs_biz_prem_srch,Insight Global
3693056133,11056.0,Demand Planner,"Position: Demand PlannerLocation: Remote in GA or TN Duration: Direct HireWork Authorization: US Citizen or Green Card
Must-haves Bachelors in Supply Chain Mgt, Economics, Finance or related 5 years in Demand Planning Experience building & managing end-to-end demand planning processes Advanced in Excel Great verbal & written communication  Plusses Experience with change mgt & organizational transformation Experience with ERPs: SAP, AS 400, or Microsoft Dynamics Planning Tools - Demand Solutions, OMPartners, APO, etc Visualization tools, especially Power BI or Tableau APICS Supply Chain Mgt Certifications 
 Day-to-Day A client of Insight Global's is looking for a Demand Planner to work remotely out of GA or TN. This individual will report directly to the Director of Sales & Operations and will be supporting supply chain operations by carrying out research and data analysis through monthly forecasting, KPI measurements, and process improvements. More day-to-day operations will include the management of daily reports, looking at open orders vs. inventory, reporting any discrepancies or constraints (inventory vs forecast), and maintenance of the ERP system. This individual will also work heavily with the sales team, conducting sales meetings, and educating the team to provide updates on forecasts and other analyses. A successful candidate will be very analytical, process-driven, outgoing and ready to take on a challenging role!","Tennessee, United States",Contract,Associate,https://www.linkedin.com/jobs/view/3693056133/?trk=jobs_biz_prem_srch,Insight Global
3693055170,11056.0,Business Operations Analyst ,"Position: Business Operations Analyst Location: RemoteDuration: Contract to hirePay: $26-27/hr 
Qualifications:MS Office knowledge, especially for ExcelBusiness Expertise: Apply general knowledge of business practices and acumens developed through education or past experiences.Leadership: Supervising offshore research centers; accountable for own contribution and teamwork.Problem Solving: Solve routine problems using existing procedures and information, standard practices, and knowledge.Impact: Works within standardized procedures and practices to achieve objectives and meet deadlines.Interpersonal Skills: Internal communication via calls and emails; external communication mostly via emailRequires a college or university degree, or the equivalent work experience that provides exposure to teamwork, professional communication, and technical acumen. Pluses:Business fluency in Spanish is slightly preferredGeopolitical, business and cultural knowledge of region of responsibilityPower BISQLTableau Day to Day:Review source documents for data input being performed by research centers.Check accuracy and relevance of input and output data by visual examination, correcting codes and batching for computer processing.Verify output against control/standard, review format and accuracy of profiles, and distribute information to appropriate departments.Provide research and administrative support to research centers and other departments.Gather information, conduct background searches and fact checks.May conduct competitive research.Perform routine assignments starting at the entry level to more senior levels according to job progression.",United States,Full-time,Associate,https://www.linkedin.com/jobs/view/3693055170/?trk=jobs_biz_prem_srch,Insight Global
3693054176,11056.0,Director of Purchasing and Procurement,"Role: Director of Purchasing and ProcurementLocation: Local to Woodridge, IL - 5 days onsite but flexible if neededDuration: Permanent Direct HireSalary: 95k - 120k + Annual Bonus
Must Haves:5 + years of experience with Purchasing or Procurement backgroundWorked with vendors and mass quantity productsExperience managing purchase ordersExperience with negotiating prices, discounts, and transportation of merchandiseSomeone who is a leader and team orientated / good culture fit
Nice to haves:Experience with EclipseBachelor's degree
Day to Day:This person will represent the company, negotiate contracts, and formulate pricing with suppliers. You will be working with vendors and buying and distributing materials and supplies. You will be working with warehouse operations to provide effective delivery of material to customers, as well as pick up of material procured locally to Woodridge, IL.","Woodridge, IL",Full-time,Director,https://www.linkedin.com/jobs/view/3693054176/?trk=jobs_biz_prem_srch,Insight Global
3693053487,11056.0,Site Civil Engineer,"Quick interview process! 
Must Haves:Bachelors Degree in Civil Engineering4 years of experience designing and creating plans for civil projectsProfessional Engineer (PE)Experience using Civil 3D
Day-2-Day:Design and plan production for general civil on wide variety of projects, including site layouts, horizontal and vertical control, grading and drainage, paving, site utilities, and associated civil engineering activitiesPerform quantity calculationsPrepare specifications and contract documentsPerform complex assignments exercising judgment in evaluation, selection and modification or standard engineering techniques and proceduresMake decisions on significant design and engineering procedures as neededFunction as technical specialist or Project Manager on mid-size projects as needed, but project management is not the sole focus of this positionSupervise small staff of professionals and technicians as needed","Phoenix, AZ",Full-time,Mid-Senior level,https://www.linkedin.com/jobs/view/3693053487/?trk=jobs_biz_prem_srch,Insight Global
3693052262,11056.0,Staff Project Controls Specialist,"Desired Skills and Experience *Bachelor's degree in Engineering, Construction Management, Finance or related field3-8 years of project controls focused roles (schedule management, schedule creation, cost reporting, cost management, cash flow, forecast etc.)Experience with Oracle Primavera P6Excellent written and verbal communication skills.Excellent interpersonal skills.Willingness to travel to client sitesPlussesPrevious EPC projects experienceDay-to-Day *Insight Global is looking for a Staff Project Controls Specialist to sit onsite in the Houston Galleria area. They will be joining the Construction group with a large EPC company. This person will be responsible for leading the project controls process with the internal project management team to execute project deliverables within budget and schedule. They will be specifically working on developing, implementing, and maintaining external and internal cost reports, cash flows, schedule management, and logistics of all phases of a project. The ideal individual will have previous experience with an EPC firm, and understand how to align budgeting and scheduling to fulfill external and internal deliverables on time and within budget. This candidate would be excited to lead others and thrive in a fast-paced team environment.","Houston, TX",Contract,Entry level,https://www.linkedin.com/jobs/view/3693052262/?trk=jobs_biz_prem_srch,Insight Global
3693052077,11056.0,Director of Used Inventory,"Title: Director of Used InventoryLocation: Lincolnshire, IL  (Hybrid, onsite Monday, Tues, Thurs) Salary: 150K– 200K Interview Process: 1-2 interviewsWhy is this open: They need someone to own the strategy of growing their used inventory and improving the algorithms that determine the value of the inventory.
Required Skillset:Experience working in the retail industry specifically within inventory management.Strong background in data science and data analyticsSQL & Python coding skills – will need to write scripts and pull data to develop/enhance valuation algorithms Has great communication skills and has a “go getter” mentality  Plusses:MBAPeople management experience Day to day: Insight Global is looking for a Director of Used Inventory for one of our large retail clients in the Lincolnshire, IL area. This role will be over used valuation, reconditioning, inventory balancing, and big picture game planning. A large part of this position will be building out and improving the algorithm used for product valuations, so we need an expert of moving through granular data to determine formulas that predict what these used products are worth. They will own communication internally and externally with manufacturers. The Used Inventory Director will be over a team of 9, including one manager.","Lincolnshire, IL",Full-time,Mid-Senior level,https://www.linkedin.com/jobs/view/3693052077/?trk=jobs_biz_prem_srch,Insight Global
3693052011,11056.0,Accountant,"Insight Global is looking for an Accountant to support a top Agribusiness local to the Twin Cities. This position will play an active role in the month-end close and financial reporting process. The ideal candidate will have excellent communication skills, both verbal and written, and strong analytical, problem-solving, and technical accounting skills with a strong desire to learn. The ability to prioritize, efficiently plan work activities, and be detail and results-oriented is critical to the position. Responsibilities:• Prepare and file monthly and quarterly grain taxes with the appropriate state agencies by performing reconciliations between transactional and ERP systems to ensure all assessments are captured and correct amounts are paid by multiple deadlines. Also handle periodic external audits initiated by the state agencies.• Maintain Federal and State Grain licenses and process annual renewal• Annual renewal of state lottery and state business licenses• Bond renewals related to Federal and State Grain licenses and other miscellaneous bonds• Process requests for employees weighing and grading licenses in e-Grain• Monthly Wisconsin Indemnity Fund reporting• Ad hoc projects/requests","Inver Grove Heights, MN",Contract,Mid-Senior level,https://www.linkedin.com/jobs/view/3693052011/?trk=jobs_biz_prem_srch,Insight Global
3693051919,11056.0,Data Center Technician,"Job Title: Data Center Technician 1Location: Goodyear, AZ Duration: 3 months plus possible extension up to 18 months, possible contract-to-hireShift Schedule: Must be flexible to work A SIDE/DAYS (Sun-Tue and every other Wed, between 6:30am-6pm), B SIDE/DAYS (Thu-Sat and every other Wed, between 6:30am-6pm) or Mon-Fri (core working hours)
Job Description: Must HavesBasic knowledge of computer hardware, servers and components6 months of experience supporting IT equipment or related technologyBasic understanding of Microsoft Office applications (Outlook, Excel, Word)High school diploma, GED or equivalent PlussesPrevious datacenter experience  Day to DayRemove network cables as part of a datacenter decommissionRun/Label/Stage Power & Networking cablesDBD removal only (does not perform any scanning)Follows procedures for preparing, installing, performing diagnostics, troubleshooting, replacing, and/or decommissioning equipment with guidance from Datacenter Technician LeadsPrepares, stages, sets up, and performs basic startups and shutdowns for hardware following written instructions, checklists, guides, standard procedures, and with guidance from Datacenter Technician Leads Physical audits of datacenter assetsPrepares, stages, sets up, and performs startups and shutdowns (e.g. racks hard drives, switches) according to specific instructions, checklists, guides, standard protocols, and e-mailsPerforms post-execution quality checks and verifies that grounding, staging, labeling, and cabling are set up properly according to safety protocols, deployment standards, and planned Network Design Tasks (NDTs)Performs diagnostics and troubleshooting following standard procedures, quickly identifies the cause(s) of issues, and replaces faulty componentsDecommissions hardware for simple changes and refreshes (e.g. memory upgrades, OS rebuilds) following standard procedures with minimal guidanceFollows procedures to communicate, report, and escalate incidents to appropriate Datacenter Technician Leads","Goodyear, AZ",Contract,Associate,https://www.linkedin.com/jobs/view/3693051919/?trk=jobs_biz_prem_srch,Insight Global
3693051764,11056.0,Semiconductor Equipment Technician,"Day-to-Day A Semiconductor client in Phoenix, AZ is looking for an Equipment Technician to join their team. The Equipment Technician will be responsible for providing preventive maintenance to 300mm Semiconductor equipment. They also will be performing quality checks, responding to error messages, reviewing Statistical Process Control charts and conducting defect troubleshooting. This role will be performed in a cleanroom environment and will require wearing coveralls/bunny suit. Training will be provided for the first 6-9 months in the form of OJT, SOP, Shadowing, Video training and Trainer led sessions. This candidate must be available to work compressed work shifts (12-hour shifts in a 3 or 4 day work week) as well as comfortable working either day or night shifts (15% shift differential for night shifts) .

Desired Skills and Experience High School Diploma or GED1-5 Years experience providing mechanical repairs and troubleshootingComfortable working in Cleanroom environment (Bunny Suit Required)Ability to lift moderate weights and work on factory floor working with toolsMust be comfortable working compressed work weeks (12-hour shifts in a 3 or 4 day work week)Must be available for both Day and Night shiftsPlussesAAS Degree or Technical Certificate (HVAC, Welding, etc)Military (4+ years in maintenance technician role)Mandarin Speaking","Phoenix, AZ",Full-time,Associate,https://www.linkedin.com/jobs/view/3693051764/?trk=jobs_biz_prem_srch,Insight Global
3693051734,11056.0,Senior Business Analyst,"*This position requires US Citizenship or Green Card work authorization status* 
Must Haves:Experience facilitating communication between technical teams and business stakeholders to ensure that projects align with organization goals and deliver value.Experience gathering and analyzing business process requirements and proposing solutions. Strong understanding of business process modeling, analysis techniques, and process improvement methodologies.5 years in a Business Analyst role Experience in an Agile team environment  Plusses:RPA Development experience Familiarity with RPA platforms and tools  Day to Day:Insight Global is seeking a Senior level Business Analyst to join the team of a large electric utility company in Oklahoma City, OK. This individual will be joining the Automation and Productivity team. The main responsibilities of this role will be gathering and analyzing requirements, facilitating communication between internal stakeholders and RPA developers, documenting business processes, and assisting the implementation of projects to improve processes and systems",Oklahoma City Metropolitan Area,Contract,Mid-Senior level,https://www.linkedin.com/jobs/view/3693051734/?trk=jobs_biz_prem_srch,Insight Global
3693051581,11056.0,Customer Service Representative,"Desired Skills and Experience Minimum of a High School Diploma- Minimum of 1 year in Customer Service or Call Center related role- Excellent Communication Skills- Ability to begin work on 9/25/2023- Comfortable working flexible shift: (There will be shift bids based on quality/ meeting KPIs)LSA will work 3 days Mon-Thurs (9AM-6:30PM) and there is 1 day (12PM-9PM EST) each week.For ex) They could work Sunday 12PM-7PM EST, Monday -- Wednesday 9AM-6:30PM EST, off Thursday, and on Friday 12PM-9PM EST. It varies.
Day-to-Day A client of Insight Global's is seeking a Learner Services Advisor that provides assistance to students in their development and ongoing achievement of education goals, providing students with academic planning services based on program requirements and support services, and promoting student success and retention through effective communication, service, and support. The LSA will contacts students on a regular basis to build and maintain rapport and serves as the student's advisor and first point of contact to ensure questions are answered and concerns are resolved. Assist students with questions related to course navigation, academic policies, course expectations, technical assistance, and other student support services. Provide guidance to at-risk students to ensure student success. Provide on-going student retention efforts. Participate in process improvement initiatives. Call students to procure proper forms and paperwork as needed.","Florida, United States",Full-time,Associate,https://www.linkedin.com/jobs/view/3693051581/?trk=jobs_biz_prem_srch,Insight Global
3693051486,11056.0,Automation Control Engineer,"Position: Control EngineersDuration: PERMLocation: Cleveland, OHSalary: 110-120k 
 Desired Skills:  • BS degree • 5+ years of automation control experience (PLC) • Experience leading mid to large size manufacturing projects 
Day to Day:• Identifies, Develops, and supports the selection of new equipment and new processes across the enterprise. • Applies both standard and advanced engineering techniques to drive reductions in cost while ensuring high quality and exceptional service • Independently develops clear and specific objectives for given assignments that may require the investigation of several alternative solutions • Contributes to long-term thinking and planning for improvement • Develops expertise as an SME on manufacturing equipment  • Provides guidance to co-ops, technicians, and other engineers  • Effectively participates in a team setting to achieve results • Effectively leads assigned projects of moderate to large scope for assessments or implementations of new manufacturing equipment or processes Assesses current manufacturing equipment and processes and makes recommendations on future solutions for equipment and processes. • Recommends and/or creates and executes plans for process improvements and new processes based on expected results • Identify, create, and apply best practices and standards within the operations group. • Provide analytical problem solving and process troubleshooting support in area of expertise • Analyzes or interprets process changes in a complex manner (e.g. DOE, DFMEA, PFMEA) • Actively support the development of co-ops, technicians, and engineers • Completes project definitions, Exhibit A/EPA, and CEPM as required on projects. • Is a corporate resource for technical questions concerning manufacturing processes and equipment • Communicate progress through management updates and team meetings","Cleveland, OH",Full-time,Mid-Senior level,https://www.linkedin.com/jobs/view/3693051486/?trk=jobs_biz_prem_srch,Insight Global
