job_id,company_id,title,description,location,job_type,job_required_experience_type,job_posting_url,company_name
3757484496,11056.0,Supply Chain Analyst,"Insight Global is seeking a Supply Chain Analyst to join the CFO of one of the top healthcare systems in New York. This person will be responsible for preventing supply risk or surplus from occurring by utilizing external and internal data to create an inventory strategy. Responsibilities will include determining optimal inventory targets, facilitating the safety stock replenishment process, forecasting demand needs, and working closely with suppliers to plan for current and future demand. They will also calculate optimal inventory targets, develop and implement solutions to issues, and collaborate with key stakeholders, both internally and externally, to meet goals and objectives. The ideal candidate has an analytical mind as well as excellent communication and presentation skills.
Required Skills and Experience1+ years of experience in Supply ChainTechnical proficiency in ExcelExcellent written and verbal communication skillsBachelor's DegreeCovid vaxxed
Nice to Have Skills and ExperienceHealthcare experience","New York, NY",Full-time,Mid-Senior level,https://www.linkedin.com/jobs/view/3757484496/?trk=jobs_biz_prem_srch,Insight Global
3757483768,11056.0,Systems Engineer (Onsite),"Salary: 110k-160kLocation: 5 days onsite in Dexter, MI
Summary: Looking for a candidate with a hardware/firmware background, with experience in C++ and Matlabs.
Day to Day:Insight Global is looking for a Sr. Systems Engineer to join one of our largest industrial clients. This highly motivated and hands-on individual will be responsible developing the hardware and firmware for new gas analyzer products from the ground up. They will utilize C++ and help with the calibration of these devices. This individual must have an excellent understanding of both analog and digital electronic designs. This is an onsite position based out of Dexter, MI.
Must Haves:8+ years of Systems Engineering experience, specifically with new product hardware and firmware developmentC++ expertiseMATLAB Simulink experienceAbility to do hands-on coding effectively with minimal supportEmbedded circuit design experience using microcontrollers, such as the ARM CortexThorough understanding of fundamentals of electronic design, both analog (such as amplification circuits) and digitalUnderstanding and experience of PCB layout including multi-layer designs and electromagnetic compatibility (EMC)Bachelor's Degree in Electrical Engineering, Computer Engineering, Software Engineering, Computer Science, etc.Excellent communication skillsMust work 5 days onsite in Dexter, MI Plusses:SQL database experienceHazLoc/Hazard Location or Atex experienceSensor or laboratory background","Dexter, MI",Full-time,Mid-Senior level,https://www.linkedin.com/jobs/view/3757483768/?trk=jobs_biz_prem_srch,Insight Global
3757483387,11056.0,Target Systems Analyst,"Location: Reston, VA OR Colorado Springs, CO - 100% onsiteLength: 6-month contract to hireSalary: 130-150k (dependent on location)Clearance: TSSCI
Day to Day:Insight Global is looking for an experienced Space Targeting Analyst to support a classified space customer in Reston, VA OR Colorado Springs, CO. This individual will be conducting intelligence analysis on US adversary space assets and analyzing these assets for possible vulnerabilities. You will be responsible for unraveling threat architectures and system functions using data from various intelligence sources.  Must Haves:-Bachelor's Degree -3-10 years of related experience - particularly in target systems analysis (TSA), Critical Factors Analysis (CFA), Center of Gravity (CoG), or space weapons -Ability to use intelligence data to create comprehensive reports -Kill chain analysis experience","Reston, VA",Contract,Mid-Senior level,https://www.linkedin.com/jobs/view/3757483387/?trk=jobs_biz_prem_srch,Insight Global
3757482391,11056.0,VBA Programmer,"**W2 ONLY**
Day-to-Day:Insight Global is looking to add a VBA Programmer to our client's team in the St. Louis, MO area. This individual will be responsible for writing scripts in VBA and utilizing macros to do so for their automation team. Currently this client is migrating from their original system to a new database and this individual will be assisting with migrating code from their CICS application they use to connect their current database to the new terminal emulator software. There will be some expectations to communicate with both technical teams and stakeholders to gather information.
Must-haves:2+ years of experience scripting in VBAExperience creating macros to automate processesExperience supporting O365",Greater St. Louis,Full-time,Associate,https://www.linkedin.com/jobs/view/3757482391/?trk=jobs_biz_prem_srch,Insight Global
3757481931,11056.0,Sr. Lead Piping Designer,"Must HavesHigh School Diploma or GED requiredE3D Design Software experience requiredExperience in offshore oil & gas, onshore gas processing, hydrocarbon storage and transportation, chemical manufacturing or refining industry requiredSmall project lead experience requiredAbility to find a solution for or to deal proactively with work related problemsAbility to read and understand drawing markups to determine drafting requirementsAbility to utilize conventional drafting tools and CAD software to execute drafting requirementsAbility to work in a team oriented environment Job DescriptionThe Senior Lead Piping Designer/Coordinator will perform assignments associated with leading a mechanical design team on E3D projects, with an understanding of resourcing, reporting, budgeting and updating project progressPrepare estimates for projects to be performed in E3D, and to track progress and resources against allocated design budgetsHave a basic understanding of the capabilities of E3D Administration and how to communicate with that groupCoordinate work with design team as well as assist in mentoring younger designersCoordinate model reviews with design team and engineering teamReviewing, commenting, and approving vendor dataProficient with organizing vendor cutsheets, drawings, and project deliverablesGeneral understanding of E3D piping cataloging capabilitiesPrepare complete design packages which may include, but not be limited to, preliminary, conceptual, and construction deliverables as well as engineering calculationsPrepare detailed drawings of parts and assemblies from layouts, designs and working drawings including necessary projections, sectional views and standard specificationsInterpret verbal or written direction to initiate a preliminary designAssist with stress analysis, compiling construction specifications, equipment and material procurement, calculations, and estimatesCheck detailed sketches and drawings for project applicability and optimal constructionCheck and verify accuracy of drawings prepared by othersPrepare parts lists, procurement lists, bills of material (BOM) and specifications when drawings are completeRevise lists, drawings and BOM consistent with engineering changesImplement revisions and change control per company standards at the direction of engineersAssemble information and reference drawings from a variety of sourcesContinually look for product improvements and cost reductionsConfirm specification and code compliance, equipment compatibility, and optimal cost savingsAssist with performing field surveys, documenting existing conditions, and/or recommending various design solutionsEnsure accuracy of completed drawings before final release and verify drawings meet company and industry standards","Houston, TX",Full-time,Mid-Senior level,https://www.linkedin.com/jobs/view/3757481931/?trk=jobs_biz_prem_srch,Insight Global
3757481328,11056.0,Senior Materials Engineer,"Job Title: Materials Science EngineerLocation: Remote (preferred Raynham, MA or Warsaw, IN)Pay Range: $50-65/hour (contract to hire)
The Day-to-Day:Insight Global is looking to hire a remote Senior Materials Science Engineer for a top medical device client on a multiyear contract. This person will be responsible for planning, leading, and executing a materials harmonization project for 4 different divisions within the organization, and we are looking for a senior-level professional who has a strong grasp of materials science to take this on! This company currently holds a large number of materials specification documents due to acquisitions throughout the years, and as the Senior Materials Science Engineer you will be responsible for developing a strategy on how to consolidate specifications without impacting change/losing key requirements along the way. This will be a long-term project and we are looking for someone who possesses strong project management skills to not only create a plan/strategy, but to also execute it. 
Must Haves:  * Bachelor's Degree in engineering * 5+ years of materials science and engineering experience within the medical device or aerospace industry * Experience leading/planning projects and ability to work independently","Massachusetts, United States",Contract,Mid-Senior level,https://www.linkedin.com/jobs/view/3757481328/?trk=jobs_biz_prem_srch,Insight Global
3757480950,11056.0,Jr. Java Developer,"*4 Month Contract Required Skills and Experience 1+ years of experience as a Data AnalystExperience running reports and comparing old/new data setsExperience with Microsoft ExcelExperience managing multiple tasks at once
Job Description An employer in the Boulder, CO area is looking for a Junior Data Analyst. This individual will be working closely with a Senior Application Technical Admin to provide additional support for running reports on data sets. The ideal candidate would be proficient with multitasking, Excel, report generation. This is a fully remote position with a contract duration of 3 to 4 months. This client is looking for someone to start ASAP, so if you are interested, apply right away!","Boulder, CO",Contract,Mid-Senior level,https://www.linkedin.com/jobs/view/3757480950/?trk=jobs_biz_prem_srch,Insight Global
3757479261,11056.0,Healthcare Application Support Technician,"Must-haves Experience providing technical support, troubleshooting, and training for healthcare applications/software, electronic health records (EHR)Experience with EHR systems such as: AHT, EPIC, Cerner, Meditech, etc.Excellent communication and customer service skillsKnowledge of healthcare industry, medical terminology, procedures, and regulations
DESIRED SKILLS:Experience with their healthcare application – American Health Tech Software Day-to-Day NHS is seeking a support tech for their Electronic Health Records application (AHT) . They will need experience providing technical support in a healthcare environment, specifically for EHR systems. They will be responding to customer issues via email, phone, or chat and provide technical support and assistance on issues such as installation, operational functions, troubleshooting, and maintenance of their EHR system and document the support interactions, including the details of the inquiries, complaints, and actions taken.","Tuscaloosa, AL",Contract,Associate,https://www.linkedin.com/jobs/view/3757479261/?trk=jobs_biz_prem_srch,Insight Global
3757478516,11056.0,Project Manager,"Position: Project ManagerLocation: Rocky Hill, CT 06067Duration: Permanent direct hire Salary: $90-120K 
Requirements:5+ years of technical project management experience Specific experience working for a large Electrical Contractor or a Security integrator as a project manager Strong understanding of implementing project timelines and making sure everything is running in a timely mannerExperience managing projects from start to end with at least $1MM budgetMicrosoft Outlook, Project, Excel, Word, and Power Point skillsFinancial analytical skills including cost control and understanding of profit margins Basic knowledge and understanding of IT networking principalsSupervisory experience or ability to manage a team of 5 Plusses:Any industry related certificationsSomeone who started as a Technician and worked up to PM level  Job DescriptionThis resource will manage, oversee, and coordinate all aspects for our client’s security system projects from award through completion of project, including overall site management of project(s) for successful and timely completion within budget as required by the contract. They will prepare project installation plan, manage the plan, and prepare and implement job procedures. This resource will interface directly with the client’s customers and will be responsible for implementing their needs into the project plan. They will also be responsible for reviewing and approving estimated costs prior to bid, provision of technical assistance to sales force as and when required, supervision of project design engineering, supervision of installation labor and subcontractors, preparation of project schedules, subcontracts, change proposals, project invoices, and managing collections on projects. Projects will include security installation projects, cabling, devicing, programming/testing, managing subcontractors. The job sites will be in CT and western MA  Additionally, this resource will establish project milestones and analyzes costs, manage the execution and review of all scope of work, terms and conditions in customer contracts including cost control, delivery fulfillment, and quality of service and other customer requirements as they arise. The position is primarily office-based with periodic visits to work sites in the field. This person will also be responsible for managing the day-to-day of 5 individuals on the team.","Rocky Hill, CT",Full-time,Mid-Senior level,https://www.linkedin.com/jobs/view/3757478516/?trk=jobs_biz_prem_srch,Insight Global
3757477537,11056.0,Construction Project Coordinator,"Position: Construction Project CoordinatorCompany:  Faithful & Gold (AtkinsRéalis (atkinsrealis.com))Rate: Up to $29 - 35/hr or up to $70k/yrOpening: 1 - ExclusiveLocation: Hybrid in New Albany, OhioDuration: 6 month Contract-to-HireOpenings: 1Interview Process: 1 - 2 rounds dependent on schedulingHiring ManagerPanel Authorization: US Citizen or GC / W2 - Must be able to pass Drug Test including THC Day to day:A client in Columbus, OH is looking for a Construction Project Coordinator! If you want to be a part of a successful global organization and have experience with space planning, project management, space improvements, and building relationships with key stakeholders we would like to connect with you! This role requires daily coordination of project activities and tasks / requests as submitted. Must be a self-starter, possess leadership skills, be able filter and prioritize tasks, to work independently, multi-task, and take on tasks as directed by project manager. Works closely with vendors, client program and project managers by supporting the needs for the construction teams. Provides updates to projects, ARs, communications, and documentation to project manager for review and final distribution. If this sounds like you, apply today! Must haves:High School Diploma with 6 years of experience, or a Bachelor's Degree with 3 years of experienceAdvanced knowledge of Excel, Smartsheets, PowerPoint, and seating management systems.Working knowledge of project planning and execution, coordinating and scheduling with multiple teams.Excellent interpersonal and communication skills are a must - Will be working with high level client stakeholders.Need to be able to communicate and uphold client standards / expectation Why join us? Our Columbus, Ohio team is growing! If you want to be a part of a successful global organization and have experience with space planning, project management, space improvements, and building relationships with key stakeholders we would like to connect with you! This role requires daily coordination of project activities and tasks / requests as submitted. Must be a self-starter, possess leadership skills, be able filter and prioritize tasks, to work independently, multi-task, and take on tasks as directed by project manager. Works closely with vendors, client program and project managers by supporting the needs for the construction teams. Provides updates to projects, ARs, communications, and documentation to project manager for review and final distribution. Candidates with a background in high-tech manufacturing or pharmaceuticals are preferred, along with some experience with architectural drawings or floor plans. Construction experience is a plus. This role is based at a semiconductor project site in Columbus, OH. This is a full-time position with Faithful + Gould that comes with the opportunity to prove your true potential, provide expert services on world class projects, work and collaborate with professional services experts, and receive an attractive compensation package with robust benefits. How will you contribute to the team? • Assist management and daily leadership of project team • Provide daily coordination of project activities as directed by project manager • Assist project manager in the initiation, opening and closing of project management activities • Assist in creation and execution of project execution plans and revise as appropriate to meet changing needs and requirements • Manage day-to-day operational aspects of a project and scope of services • Provide updates to project documentation to project manager for review and final distribution • Update cost and schedule information in preparation for status reporting • Assist in preparation for project reviews and quality assurance procedures • Ensure project documents are complete, current, and stored appropriately • Track and report team hours and expenses on a weekly basis • Support project manager in providing regular forecast and expense updates to project budget • Coordinate communication, both internal and external, including meetings, meeting notes and action items • Effectively pursue the execution and filing of project legal documents • Develop client analyses and reports as needed • May perform such other duties as the supervisor may from time to time deem necessary • Manage / track all requests for seating and space needs • Support alignment with planning values and guidelines • Coordinate and plan any staff moves What is Required or Preferred? • High School Diploma with 6 years of experience, or a Bachelors Degree with 3 years of experience • Advanced knowledge of Excel, Smartsheets, PowerPoint, and seating management systems. • Working knowledge of project planning and execution, coordinating and scheduling with multiple teams. • Excellent interpersonal and communication skills are a must. Will be working with high level client stakeholders. • Need to be able to communicate and uphold client standards / expectations • Good customer service • Good organization skills","New Albany, OH",Contract,Associate,https://www.linkedin.com/jobs/view/3757477537/?trk=jobs_biz_prem_srch,Insight Global
3757475224,11056.0,Licensed Clinical Social Worker,"Insight Global is searching for a Clinical Social Worker for one of our top healthcare partners in the Massachusetts area. This individual will be working in a hospital containing 360 inpatient units. All patients are 19+year olds and the population includes 90% forensic individuals directly from court system with some level of legal involvement, individuals not confident to stand trial, acute risk concerns, and violent or self-violent individuals. The majority of the referrals that are admitted come through the court system and are involved with the legal system in some way. Social Workers must be comfortable working with patients that may be criminally responsible or will stand trial. Social Workers will work on a multi-disciplinary team, working with a case load of 10-13 patients. They are tasked with collaboration with discharge planning, psychosocial evaluations (both group and individual), treatment and development plans, and treatment meetings. Morning rounds and afternoon meetings is a typical day. Go to unit for morning nursing rounds, charge nurse runs through 27 patients on unit, responsible or 10-13 patients potentially, treatment team meetings - group or individual interview for psychosocial, schedule own meetings with clients, lunch, afternoon treatment teams, have some biweekly dept meetings, welcomed to participate in consult teams, scheduling meetings and meeting with clients directly, taking them to diff areas in hospital, figuring out triage, debriefing with team. This is a full-time onsite position.
Required Skills and Experience *LCSW or LICSWMasters in Social Work
Nice to Have Skills and ExperienceInpatient experienceExperience with adult mental health","Worcester, MA",Full-time,Mid-Senior level,https://www.linkedin.com/jobs/view/3757475224/?trk=jobs_biz_prem_srch,Insight Global
3757472445,11056.0,Sr. Software Engineer,"Must Haves:6+ years of Software Engineering experience, specifically with new product developmentJava and C# expertiseMATLAB Simulink experienceAbility to create detailed software coding effectively with minimal support Experience with microcontrollers, motor controls, and video signal processing and circuitsThorough understanding of fundamentals of electronic design, both analog (such as amplification circuits) and digitalKnowledge of basic firmware design for development testingBachelor's Degree in Electrical Engineering, Computer Engineering, Software Engineering, Computer Science, etc.Excellent communication skillsMust work 5 days onsite in Dexter, MI Plusses:SQL database experienceHazLoc/Hazard Location or Atex experienceSensor or laboratory background Day to Day: Insight Global is looking for a Sr. Systems Engineer to join one of our largest industrial clients. This highly motivated and hands-on individual will be responsible developing detailed software code for new gas analyzer products from the ground up utilizing Java and C#. This individual must have an excellent understanding of both analog and digital electronic designs in addition to experience with microcontrollers, motor controls, and circuits. This is an onsite position based out of Dexter, MI.","Dexter, MI",Full-time,Mid-Senior level,https://www.linkedin.com/jobs/view/3757472445/?trk=jobs_biz_prem_srch,Insight Global
3757472169,11056.0,Ecommerce Marketing Manager,"Must Haves: 4+ Years of eCommerce or Digital Marketing experienceExpertise in managing Amazon accounts, including product inventory, KPI metrics, and operational marketing Retail, fashion, apparel, or wholesale industry backgroundExcellent experience working with Microsoft tools such as Excel, Outlook, Word, PowerPoint, etc. Ability to multitask and effectively communicate Plusses: Previous experience working with channel advisors  Day to Day: Insight Global is looking for a Amazon eCommerce Marketing Manager to join a growing retail organization. This individual will be responsible for managing the client's products on their Amazon account in a cross-functional business environment. They will be dealing with all of their clothing lines ratings, inventory, new product introductions, and KPI metrics. A qualified individual will have excellent multi-tasking skills and prior digital marketing or eCommerce experience in the retail industry.","Miami, FL",Full-time,Associate,https://www.linkedin.com/jobs/view/3757472169/?trk=jobs_biz_prem_srch,Insight Global
3757471775,11056.0,Kronos Business Analyst,"Must-haves Advanced knowledge and skills within Kronos/UKG software systemExperience with Configuration, customizing, and optimizing the Kronos SystemExperience setting up workflows, rules, permissions, reports, or integrationsExperience providing tech support and guidance to Kronos users and clientsExperience training and documenting Kronos best practices
DESIRED SKILLS:A Kronos Super User, not just Kronos supportNot someone who can just support users or clients with Kronos but someone who can set up and manage the Kronos system. Day-to-Day NHS is seeking a Kronos subject matter expert (SME) to help optimize their workforce and payroll management. They will be responsible for:Configuring, customizing, and optimizing the Kronos system according to the needs and preferences of NHS. Setting up workflows, rules, permissions, reports, or integrations for the Kronos systemProviding technical support and guidance to Kronos users and clientsTroubleshooting and resolving Kronos issues or difficultiesTraining and documenting Kronos best practices and proceduresCollaborating with HR and payroll staff and other stakeholders to ensure Kronos compliance and accuracy","Tuscaloosa, AL",Contract,Mid-Senior level,https://www.linkedin.com/jobs/view/3757471775/?trk=jobs_biz_prem_srch,Insight Global
