job_id,company_id,title,description,location,job_type,job_required_experience_type,job_posting_url,company_name
3757749106,11056.0,Senior Developer,"Insight Global is seeking a Conversational Expert with over two years of extensive experience in crafting simple SMS first conversational experiences across a broad spectrum of messaging channels leveraging Twilio or similar low code solutions. This role requires a strong proficiency in API integration’s and the ability to work in fast paced environment and in cross functional teams to engage in co-creation efforts with teams across different departments to ensure alignment with organizational objectives.
Responsibilities • Designing technology solutions and writing technical specifications. • Collaborate with Product/design personnel to construct MVP product. • Write code according to technical specifications. • Implement tracking for key analytics events. • Contribute technical solution feasibility advice during design reviews. • Contribute to product backlog grooming and other Agile ceremonies. 
Required Experience • More than 5 years of experience developing applications and digital solutions from front-end to back-end. • Experience working with cloud infrastructure including interfacing with DevOps teams and understanding of CI/CD pipelines and Docker-based containerized deployments. • Experience designing, authoring, and reviewing user documentation as well as writing functional, detailed technical specifications for applications.","Sacramento, CA",Contract,Mid-Senior level,https://www.linkedin.com/jobs/view/3757749106/?trk=jobs_biz_prem_srch,Insight Global
3757748166,11056.0,Customer Service Representative,"Must HavesPrior experience in the service industry (working with customers)Highschool diplomaStrong communication and interpersonal skills PlussesPrior call center experienceBachelor's degreeDesire for long term opportunity & to grow in the company Day to Day A large financial group in Cincinnati is seeking Customer Service Consultants to join their Enterprise Engagement Center. This team is completing inbound service calls to current clients regarding payments, annuities, life insurance qualifications, beneficiaries, etc.  More responsibilities include: Reviews, researches and/or analyzes necessary policy data in order to resolve client inquiries or concerns via telephone, written correspondence, email or online chat.Provides professional and courteous service, including diffusing escalated clients to resolve concerns; completes service requests within departmental service levels.Proactively seeks resolution to client issues; uses solid judgment in recognizing the need to escalate situations to management.Provides analysis and service for all products within the Western & Southern Life portfolio.Makes independent decisions regarding customer requests, and processes policy transactions on administrative systems as necessary.Maintains accurate information and documentation in Salesforce Customer First Platform.Required to utilize multiple administration systems to service clients.Proactively conducts outbound calls to follow up on previous client concerns to ensure issues were resolved accurately and timely.Analyzes client trends to identify and mitigate risk to the Enterprise, including, but not limited to, anti-money laundering, privacy concerns, premium financing and unethical practices.Requires developing and maintaining comprehensive knowledge of state regulations, required forms, policy details, processes, current and discontinued products, etc.Develops and maintains positive working relationships with internal and external clients.Identifies cross-selling opportunities and utilizes tailored approaches to secure sales leads.Proactively conducts conservation efforts to retain business.Processes all work requests received through Imaging from various departments within established service levels.Identifies system or procedural problems and recommends improvements to benefit clients or home office associates.Services walk-in clients to the Home Office.Performs other duties as assigned by management.",Cincinnati Metropolitan Area,Contract,Mid-Senior level,https://www.linkedin.com/jobs/view/3757748166/?trk=jobs_biz_prem_srch,Insight Global
3757746075,11056.0,Project Manager,"Day To Day:An employer is looking for a quality project manager in the Santa Monica area. This individual will be responsible for coordinating all follow ups after internal GMP audits. They will work with quality and manufacturing to coordinate completion of action items identified such as; scheduling and facilitating tracking meetings, reporting status of actions, helping in coordinating resolution of actions, developing plan to complete actions. They will be reporting into a quality manager and coordinating with various teams. The ideal candidate will be very hands on and tactical, relying on MS project and excel to display their findings and progress.
MUST HAVES:-3-5+ years expereince in a quality role-2+ years in a project manager role-GMP/FDA background-Pharmaceutical or medical device background-Experience with project management software (i.e. MS Project, Primavera","Santa Monica, CA",Contract,Mid-Senior level,https://www.linkedin.com/jobs/view/3757746075/?trk=jobs_biz_prem_srch,Insight Global
3757745013,11056.0,Help Desk Specialist,"Requirements-Good customer service and written communication skills -Networking, Software, and Hardware basic troubleshooting or ability to learn -Basic Printer troubleshooting or the ability to learn -Financial/governmental/administrative systems experience -Excellent time management Plusses (Not Required)-1 year of experience in a helpdesk role Job Description *This person will provide basic technical support to include hardware deployments to various County personnel and departments. Additionally, this candidate will be providing clerical and administrative support to the purchasing & acquisition process for the clients technical needs, as well as upkeep on documentation of ordering/receipt of supplies. They need to have a technical aptitude and willingness to learn new things. They will be supporting county users and employees with technical issues.","Yreka, CA",Full-time,Entry level,https://www.linkedin.com/jobs/view/3757745013/?trk=jobs_biz_prem_srch,Insight Global
3757742953,11056.0,Contract Administrator,"Title: Contracts Manager/ Administrator Client: Insight Globals Evergreen DivisionLocation: Auburn, CA ( 2 days on site/ 3 days remote) 
Required Skills and Experience *- 5+ years or Project Engineering / Contract Management experience - Have a degree in Electrical or Mechanical Engineering - Understand how to build out construction packages and align scope of work with the services needed - Experience writing SOW's and working with sub-contractors - Excellent oral and written communication
Nice to Have Skills and Experience- Previously worked for this company - Experience with Ariba and SAP
Job Description * In this role you will be responsible for supporting our engineering clients organization and ensuring that all contracts are aligned accurately in response to the largest asset in this organization. This site is going through many updates related to generator support, heavy mechanical (turbine overhaul, generator rotation, transformer installation, disconnects and generator breakers, auxiliary plant systems and 230kv cables which will take until the end of 2024.  In this role you will be working with Project Management organization to write scopes of work for this large EPC firm they have decided to partner with on this work. You will develop construction packages with EOR, work with strategic sourcing on the RFP information, job walks with vendor and PMO to ensure safety and timing. You will also oversee identifying safety specs that have to be attached to a contract, change orders and authorizations.  We need this individual willing to do job walks as frequent as needed, be the right hand person to the PMO group and bring a go-getter attitude to work everyday.","Auburn, CA",Contract,Mid-Senior level,https://www.linkedin.com/jobs/view/3757742953/?trk=jobs_biz_prem_srch,Insight Global
3757742466,11056.0,Project Engineer,"We are seeking Project Engineer 3 to join our Utility Services division in support of a large electric Utility and their capital programs which include electric substation and transmission projects. In this role you will be responsible for coordinating with the client, design and engineering firm, and other stakeholders to review the scope of work, design submittals, and facilitate the design process from inception to close out. 
Qualifications / Experience5-10 years of design or design management experience in electric substationsBachelor’s degree in Civil, Structural, or Electrical EngineeringProfessional Engineer (PE) license in CA highly desirableExcellent written and verbal communication skills with a high level of proficiency in MS Office Word, Excel, Outlook and Project.Ability to management the design process with multiple stakeholders Knowledge of electrical substation, transmission civil, structural design
ResponsibilitiesParticipate in sponsor kickoff meetings to assist in determining scope of workPerform desktop analysis and develop preliminary detailed scope of workRequest proposals from design engineering contractors (Prime)Review Prime’s proposed engineering project scope and schedule estimates; validate, and make recommendations to discipline manager/leaderReview Prime’s requested resource estimates and make recommendations to discipline leader.Review/Recommend and process the project design specification through DocuSignReview purchase order and change order requests in AribaOversee Prime’s design engineering work including: confirm design is within scope and proceeding according to schedule, establish progress at milestones such as 30%, 60%, 90%
Additional InformationThis position will require the candidate to be in the Pomona, CA office every Tuesday and one other day in the field as necessary to support assigned projectsMiles reimbursed for commute in excess of 100 miles round tripTravel 40% - 50% of the time","Pomona, CA",Full-time,Mid-Senior level,https://www.linkedin.com/jobs/view/3757742466/?trk=jobs_biz_prem_srch,Insight Global
3757742374,11056.0,Production Inventory Coordinator,"One of Insight Global's largest aerospace clients is looking Production Inventory Coordinator. This is a multi-faceted position that will include: ordering and maintaining prex parts; replacement tools, and HAZMAT inventories. You will be processing deliveries of repaired avionics into internal and external databases as well as on-site parts deliveries to technicians. Communication with customers and computer skills are exceptionally helpful. 
Day-to-day responsibilities: - Processes and moves production and other materials into and out of storage, production and other locations to support the flow of production following standard work instructions. - Communicates status of parts and materials using automated systems and manual reporting methods to insure parts availability.- Identifies and solves problems or discrepancies of limited scope with parts and materials using established procedures or processes.- Coordinates with various functions to set priorities, expedite and complete production activities to avoid schedule delays.

 Must- Have Requirements:- 1+ year experience working within a similar field - Experience working on a diverse team - Secret Clearance required (Candidates can have an intermittent secret clearance to start OR they must be able to obtain a Secret once starting)
This role is fully onsite in Lemoore, CA. Candidates local to the area will be given priority, but those open to relocating to the area are encouraged to apply! This role is a great opportunity for those who are looking to begin a lifelong career in the aerospace industry! *","Lemoore, CA",Contract,Mid-Senior level,https://www.linkedin.com/jobs/view/3757742374/?trk=jobs_biz_prem_srch,Insight Global
3757741842,11056.0,Operating Room Manager,"The OR Manager is responsible for all departmental functions in support of the center's mission, vision, and facility goals. The Manager identifies the cost-effective systems needed to support the business of the department taking into account business trends, resource availability and changes in customers. This position establishes effective working relationships with all constituencies including patients, physicians, employees, volunteers and vendors. The Manager identifies and remedies through continuous customer satisfaction data and employee involvement. The Department Manager works with Senior Management in meeting Facility goals. Oversees surgery, anesthesia, and sterile processing services. May assist as RN Circulator and Scrub Tech as necessary.
Required Skills and Experience ** Graduate of accredited school of professional nursing.* Baccalaureate degree preferred.* Five (5) years' experience in surgery as circulator* Two (2) years' experience in surgery management which includes pre-op, intra-op, and post-op care.* Current Texas RN License- BLS* CNOR preferred* Independent decision making skills.* Ability to prioritize and handle multiple projects.* Excellent communication skills with staff and physicians.","Peoria, AZ",Full-time,Mid-Senior level,https://www.linkedin.com/jobs/view/3757741842/?trk=jobs_biz_prem_srch,Insight Global
3757739746,11056.0,Search Engine Optimization Manager,"Position: SEO ManagerLocation: Hybrid in MiamiDuration: PERMSalary: 100-110k Must-haves:7+ years of SEO experience - 2+ years of experience within a leadership/ management level role at an enterprise organizationExperience communicating across editorial teams and driving SEO StandardsExperience auditing and providing recommendations.Experience with UAT, Adobe Analytics, Google Analytics, Semrush
Pluses:Hospitality Industry experience
Day-to-day:
This person will be joining the Global Ecommerce team and will be managing and communicating SEO Standards across editorial teams in alignment with the organization's initiatives as well as making recommendations and providing strategy based on emerging trends and industry news. This person will serve as the main POC for SEO, delegating responsibilities and providing strategy, but also being hands-on performing audits, UAT testing, gathering analytics and insights as well as providing recommendations across business units. This person should have experience planning SEO roadmaps and cases and manage expectations as well as propose ideas to grow and meet business needs.","Miami, FL",Full-time,Director,https://www.linkedin.com/jobs/view/3757739746/?trk=jobs_biz_prem_srch,Insight Global
3757737999,11056.0,Backend API Developer,"Requirements:   · 5+ years of professional Backend Development experience, with a focus on Express JS · Strong background in Node JS · Strong experience with RESTful API · Knowledge of MS Azure and web app development in the cloud   Plusses (Not Required):  Any Azure Certification Experience in collaborating with startups, understanding their unique needs and constraints.   Day to Day:  Our client in the digital healthcare industry is looking for a Senior API Developer to join the Application team. They will be reporting to the Manager of Applications. They are currently working on building out both a patient and client portal for their clients. This API Developer will be creating RESTful APIs and implement and maintain frontend architectures and ensure high performance and scalability. This person will write clean, efficient, and well-documented code and integrate with back-end services and databases to ensure seamless functionality.","Florida, United States",Full-time,Mid-Senior level,https://www.linkedin.com/jobs/view/3757737999/?trk=jobs_biz_prem_srch,Insight Global
3757735945,11056.0,Software Engineering Manager,"Required Skills and Experience 7+ years of experience leading software development teamsExperience in all aspects of the software development lifecycle - designing applications, coding, testing and implementation, architectingWorking knowledge of service-oriented architecture (SOA) principles and .NET, ASP.NET, C#, SQL Server Database, and Oracle DatabaseStrong understanding of Object-Oriented Programming and designStrong Agile mindset and experience working in a Scrum environmentUnderstanding of and experience using servant leadershipBachelors Degree
Nice to Have Skills and ExperienceMaster's Degree in related disciplineMS Certified in .NET technologies
Job Description A large healthcare company is looking to hire a Software Engineering Manager to help with the development, management and strategic direction of software engineering teams. The goal of this role is to lead a self-managing and governing team. You will be responsible for hiring, developing, and leading QA Engineers, Software Developers, Product Owners, and Scrum Masters. There will also be collaboration with infrastructure groups, the Value Management Office, and other business units. You must have the ability to motivate individuals and teams as well as provide technical guidance and strategy when needed. This person will be working in an agile scrum environment. This position is fully remote but CST and EST working hours are highly preferred.","San Dimas, CA",Contract,Mid-Senior level,https://www.linkedin.com/jobs/view/3757735945/?trk=jobs_biz_prem_srch,Insight Global
3757735117,11056.0,Paralegal,"Insight Global is hiring for a Part-Time Family Law Paralegal in Denver, CO.
Responsibilities:Legal Document Preparation:Assist attorneys in preparing and organizing various legal documents for upcoming cases and trials.Draft contracts, depositions, pleadings, and other relevant legal paperwork.Proficiency in trial exhibit preparation.Family Law Expertise:Minimum 2 years of experience in family law.Familiarity with family law procedures, including divorce, child custody, and related matters.E-filing and Calendar Management:File documents electronically with the courts.Maintain accurate calendars for court appearances, deadlines, and client meetings.Flexible Work Arrangement:Committed to working 25 hours per week.Open to remote work, with occasional in-office presence as needed.Willingness to work mornings on several days a week.
Qualifications:Experience:Minimum 5 years of overall paralegal experience.At least 2 years of specific family law experience.Skills:Strong organizational skills and attention to detail.Excellent communication and interpersonal abilities.Ability to work independently and collaboratively with attorneys and clients.Experience with Math4law, CLIO, or similar legal software.Proficient in Microsoft Excel.","Denver, CO",Part-time,Associate,https://www.linkedin.com/jobs/view/3757735117/?trk=jobs_biz_prem_srch,Insight Global
3757730700,11056.0,Validation Engineer,"Must-haves2-5 years of commissioning qualification and validation expAssociates DegreeControl system programming, commissioning, calibration expExp with editing and authoring validation protocols and reportsOEM or Integrator Exp Plusses Day-to-DayInsight Global is looking for a Validation Engineer for one of our OEM Systems Integrator clients to support their various clients across the US, Canada, and Puerto Rico. 65% of their time will be spent authoring and developing validation protocols (IQ OQ) and FAT documents. 35% of their time will be spent traveling to various customer sites to perform validation testing of internal equipment and control systems (programming and calibration, I/O forcing, PID loop tuning).
Essential Job Function: 1. Must have the ability to develop validation protocols (IQ and OQ), validation reports, and factory acceptance test documents. As such, good writing and grammar skills and attention to detail are essential. 2. Experience is required in reading and interpreting electric and pneumatic controls, technical design documents, and PLC code. 3. Travel 25 to 35% to customer sites to perform validation testing of (company) equipment and control systems. 4. Familiarity with industry accepted practices for documenting test results, recording of deviations, and deviation resolutions. 5. Must have excellent communication skills and be comfortable presenting the validation results to our customer’s project team (QA, validation, project management, etc.). 6. Must have good troubleshooting skills. Prior experience in control system programming, commissioning, calibration, I/O forcing, PID loop tuning, and/or equipment service is desirable. 7. Must be willing and be capable to climb ladders and to enter restrictive spaces. 8. Must have an understanding of computer system validation including knowledge of GAMP 5 and CFR 21 Part 11","Ramsey, NJ",Contract,Mid-Senior level,https://www.linkedin.com/jobs/view/3757730700/?trk=jobs_biz_prem_srch,Insight Global
3757729356,11056.0,Test Engineer,"Title: Test EngineerLocation: El Segundo, CAJob Duration: 12 Months - Possible conversionPay Rate: $45-50/hr
Benefit packages for this role will start on the 31st day of employment and include medical, dental, and vision insurance, as well as HSA, FSA, and DCFSA account options, and 401k retirement account access with employer matching. Employees in this role are also entitled to paid sick leave and/or other paid time off as provided by applicable law.
Must Haves: 1+ years of experience working in a laboratory environment1+ years of experience with test instrumentation and/or methodsAbility to work variable shifts and shifted work weeks to meet business demand. Start/End Time: 1st shift (0600 -- 1430); 2nd shift (1400 -- 2230); 3rd shift (2200 -- 0630) Knowledge/Experience with RF testing equipment & methodologies.Active Top Secret clearance Day to Day:An employer is looking for a Junior Test Engineer to join a large Aerospace client in El Segundo. You will join a team of 15 engineers who are supporting the certification, configuration, calibration of support test equipment as well as supporting automated and manual test execution on spacecraft programs. This individual will participate in gathering and analyzing requirements for test measurement systems. Assisting in the development of test procedures, and instrumentation and configuration definition to perform the test within the constraints of the test plan. Develop solutions to calibration systems problems. Performs data analysis, develops and utilizes data processing tools. Designs simple component level hardware or software. Uses analytical tools to verify the design. Verifies collection of complete data set. Maintains test logs, prepares simple test reports and archives data. Works under direct supervision.","El Segundo, CA",Contract,Mid-Senior level,https://www.linkedin.com/jobs/view/3757729356/?trk=jobs_biz_prem_srch,Insight Global
3757727835,11056.0,Computational Fluid Dynamics Analyst,"Must Haves:3-5 years of experience in thermal fluid sciences (Fluid mechanics, thermodynamics, and heat transfer)Proficient with scripting languages (Python or MATLAB)Experience running CFD analysis and lower fidelity meanline and streamline codesExperience with CFD software (Ansus Fluent, Star CCM+)Experience with CAD (Solidworks preferred)Experience with Vapor Cycle Systems (VCS), Liquid Cooling Systems (LCS), or Air Cycle Systems (ACS)USC with ability to obtain DoD security ClearanceBS in Mechanical Engineering or related Field
Plusses:Familiar with Bearing Selection for Ball Bearing and Foil Bearing ApplicationsFamiliar with positive displacement type compressors and pumpsFamiliar with aerospace requirements management methodologies and processes (Traceability, Decomposition, Derivation, Verification, Validation)Familiar with major aircraft systems (ECS, Powerplant, Electrical, Hydraulics, Controls, Avionics, Power generation, structures) D2D:The Aerospace Aerodynamics/CFD Analyst provides analytical modeling capabilities to the systems engineering team by leading component design around high-speed turbomachinery including pumps, compressors, turbines, and fans, and assisting system level studies with CFD mapping of ducts, manifolding, valve design, and heat exchanger headers and core design. In cooperation with the Program Management team, the Aerospace Aerodynamics/CFD Analyst leads and executes component design and analysis efforts for rotor sizing and design using a combination of 1-D meanline and streamline code and CFD. This role is responsible for performance requirements compliance assessment at the component level and assisting system level compliance assessment when appliable, interpreting and analyzing test data, synthesizing test data and correlating component models, building up and maintaining CFD models and model toolsets, and methodology. During the program, the Aerospace Aerodynamics/CFD analyst will work with a multi-disciplinary project team of subject matter experts in fields such as such as thermal system and aerospace analysis, installation, mechanical design and analysis, reliability, controls, electronics and software, and testing.","St George, UT",Full-time,Mid-Senior level,https://www.linkedin.com/jobs/view/3757727835/?trk=jobs_biz_prem_srch,Insight Global
