,degree,field
0,Bachelor of Arts (B.A.) Honours,English Language and Literature
1,Business Analysis Essentials Certification,Business Analysis
2,Project Management Essentials Certification,Project Management
3,Post Graduate Certificate,Technical writer
4,Bachelor of Arts (B.A.) Honours,Psychology with a minor in English Language and Literature
5,"Bachelor of Arts (B.A.) Marketing, Communication, Design","Marketing, Communication, Design"
6,"English, French, Dutch, German, Art, History, Math and Economics","English, French, Dutch, German, Art, History, Math and Economics"
7,Electronic Engineering,Electronic Engineering
8,Unix System Administration,"Information Technology, Computer Science"
9,Bachelor of Engineering (B.Eng.),Engineering
10,Bachelors of Science in Pharmacology,Pharmacy
11,Bachelor of Business Administration - BBA,Tourism and hospitality Management
12,Diploma in Commerce,Commerce
13,Diploma in Commerce,"Business/Commerce, General"
14,Business Management,Human Resources Management and Services
15,Bachelor's degree of Food Science,Food Science
16,Bachelor of Science in Biochemistry and Biotechnology,Biochemistry and Biotechnology
17,Bachelor of Laws (Legum Baccalaureus; LLB),Law
18,Postgraduate Diploma in Legal Practice,Law
19,Master of Business Administration (MBA),"Finance, Operations"
20,Bachelor of Arts in History,History
21,Bachelor of Science in Electrical Engineering,Electrical Engineering
22,Master of Arts - MA,Pianist
23,Master in Science (Hons) Pharmacology with A Professional Placement Year,Pharmacology
24,Postgraduate Diploma in Medicine and the Medical Biosciences,Medicine and the Medical Biosciences
25,Bachelor of Fine Arts (B.F.A.),Graphic Design
26,BSc. Hons. Computer Science,Software Engineering of Distributed and Internet Systems
27,Mechanical Engineering,Engineering
28,Master's degree of Applied Psychology,Applied Psychology
29,Master's degree of Social Work,Social Work
30,Postgraduate certificate in Management & Leadership,Management & Leadership
31,Bachelor's degree in Social Sciences,"Human Services,"
32,Diploma in Justice studies,"Laws, Legal Practice"
33,Graduate Diploma in Legal Practice,"Laws, Legal Practice"
34,Bachelor of Laws (LLB),"Laws, Legal Practice"
35,Master of Public Administration (M.P.A.),Political Science and Government
36,Licentiate degree (Postgraduate) in Political Science and Government,Political Science and Government
37,Bachelor's degree of Engineering,"Electrical, Electronics and Communications Engineering"
38,Bachelor of Architecture - BArch,Architecture
39,Masters in Management Information Systems,Management Information Systems
40,Master of Business Administration (MBA),Marketing
41,Bachelor's degree of Arts in Marketing / Accounting,Marketing / Accounting
42,Postgraduate of Big data & Data Analytics,Big data & Data Analytics
43,Specialty' s degree of Internal Controls,Internal Controls
44,"Hotel Management, Catering Technology and Applied Nutrition",Hotel Management
45,Foreign languages faculty,Language Interpretation and Translation
46,Master of Business Administration (MBA),Marketing and Finance
47,Bachelor of Commerce (B.Com.),Tax Law/Taxation
48,Master's degree in Construction Engineering,Construction Management
49,Bachelor of Engineering - BE,Civil Engineering
50,Batchlor of engineering in power plant engineering,Power plant commissioning operation and performance
51,Integrated Studies,General Studies
52,"Public Relations, Advertising, and Applied Communication",Freshman-Sophomore
53,High School Diploma,General Studies
54,Master of Science (MS) of Aerospace Engineering,Aerospace Management
55,Bachelor of Science (BS) of Geosciences,Geological and Earth Sciences/Geosciences
56,Oral and Maxillofacial Surgery,Oral and Maxillofacial Surgery Residency Program
57,Master of Dental Surgery (MDS),Oral and Maxillofacial Surgery Residency Program
58,Bachelor of Dental Surgery (BDS),Oral and Maxillofacial Surgery Residency Program
59,Master of Arts (M.A.) in Graphic Design,Visual Communication Design (User Interface)
60,Bachelor of Business Administration (B.B.A.),International Business
61,High School Diploma,High School/Secondary Diplomas and Certificates
62,Criminology,"Criminal Justice, Police Science, Law, Legal Practices"
63,Law Enforcement,"Criminal Justice, Police Science, Law, Legal Practices"
64,Criminology,"Criminal Justice, Police Science, Law, Legal Practices"
65,BS ACCOUNTING,Accounting and Business/Management
66,Master in Business Administration,Accounting and Finance
67,Master of Arts - MA with CLD (Culturally & Linguistically Diverse) Certification,Communication and Learning Disorders
68,Bachelor of Arts (B.A.) in Communication,"Communication Sciences and Disorders, Special Education, Leadership and Administrative Skills"
69,Master of Science - MS in Physics,Physics
70,Bachelor of Applied Science - BASc in Communication,"Communication, Journalism, and Related Programs"
71,Early Childhood Education and Teaching,Early Childhood Education and Teaching
72,Diploma,High school
73,Humanities/Humanistic Studies,"Social Sciences, History, Human"
74,B.O.Q bill of quantities,Architecture engineering
75,Master of Science (M.S.) in Clinical Studies,Clinical/Medical Laboratory Science/Research and Allied Professions
76,Bachelor of Science (BS) in Biology,Biology
77,Craft Catering,Craft Catering
78,Master of Powertrain,Harley-Davidson Technician
79,Associates in Visual Communication,Visual Communication/ Graphic Design
80,Bachelor's degree in Nursing,Registered Nursing/Registered Nurse
81,Pre-Nursing Studies,"Healthcare, Nursing"
82,High School Diploma,General Studies
83,Bachelor Commercial Engineering,"Engineering, Commercial, Commerce"
84,Bachelor's degree in Business Administration and Management,"Business Administration and Management, General"
85,High School Diploma,High School/Secondary Diplomas and Certificates
86,Associate of Arts and Sciences - AAS,General Studies
87,Associate's degree in Business Administration and Management,"Business Administration and Management, General"
88,"Minor in Japanese, Spanish, Korean",Foreign Language
89,Minor in Fashion Design and Application,Fashion
90,Bachelor of Applied Science (B.A.Sc.) in Nursery,Nurse Practitioner/ OBG-YN
91,BSc Management,ROOMS DIVIVSION
92,Bachelor of Dental Surgery (BDS),Dentistry
93,Digital Marketing,Digital Marketing
94,Marketing minor in Spanish,Marketing with Spanish
95,English A Level,A levels
96,Bachelor's degree of Science in Physics,Physics
97,Business Management and Marketing,"Business Management, Marketing"
98,"Bookeeping, Accounting",Bookeeping (Accounting)
99,Bachelor of Applied Science - BASc in Technology Management,Technology Management
100,Associate's degree in Biomedical Engineering Technology,Biomedical Engineering Technology
101,Master of Social Work (MSW),Social Work
102,Bachelor of Applied Science (BASc) in Nursery,Registered Nursing/Registered Nurse
103,Associate of Science (AS) in Healthcare Practition,Registered Nursing/Registered Nurse
104,Diploma in Nursing Training,Licensed Practical/Vocational Nurse Training
105,Associate of Science (A.S.) of Dental Surgery,Surgical Technology/Technologist
106,Bachelor of Business Administration (B.B.A.),"Business Administration and Management, General"
107,Associate in Arts,Associate in Arts
108,Bachelor's degree in Electrical and Electronics Engineering,Electrical and Electronics Engineering
109,Certificate in Project Management,Project Management
110,Bachelor of Science (B.S.),"Business Administration and Management, General"
111,Postgraduate diploma in Data science,data science
112,Bachelor of Engineering (B.E.),Computer Technology/Computer Systems Technology
113,ECONOMICS AND GLOBALIZATION,ECONOMICS AND GLOBALIZATION
114,ECONOMICS,ECONOMICS
115,POLITICAL ECONOMY,POLITICAL ECONOMY
116,"Systems and Information Engineering, Studio Art","Systems and Information Engineering, Studio Art"
117,Master in Business Administration (MBA),Human Resources
118,Theological Exegesis,Theological Exegesis
119,Master of Arts (MA) in Biblical and Theological Studies,Biblical and Theological Studies
120,Merketing,Merketing
121,Bachelor's degree of Criminal Justice and Corrections,Criminal Justice and Corrections
122,Associate of Arts (A.A.) of Liberal Studies,Liberal Arts and Sciences/Liberal Studies
123,Bachelor of Science - BS of Mechanical Engineering,Mechanical Engineering
124,Master of Science in Computing Engineering,"Information Technology, Computer Science, Computer Engineering, Security"
125,Bachelor's Degree in Computing Engineering,"Information Technology, Computer Science, Computer Engineering, Security"
126,Master of Business Administration (MBA),Operations
127,Bachelor of Mechanical Engineering,Mechanical
128,Bachelor's Degree in Multimedia,Digital Communication and Media/Multimedia
129,Associate's degree of Mechanical Engineering,Mechanical Engineering
130,Associate's Degree,General Studies
131,Certificate in Coaching,Coaching
132,Certificate in Administration,Administration
133,Technique Administrative and Management,Technique Administrative
134,Associate's degree in Business Administration and Management,"Business Administration and Management, General"
135,Master of Business Administration - MBA,"Business Administration and Management, General"
136,Bachelor of Technology (BTech) in Information Security,Computer Science
137,Bachelor's degree in Acoustics,Audio Arts & Acoustics
138,Master of Business Administration (M.B.A.),Finance
139,Bachelor of Science (B.S.) in Banking and Finance,Finance
140,Accounting,"Accounting, Finance, Business"
141,Business ownership,"Ecomonics, Psychology, Social marketing, Entrepenuer"
142,certificate in automotive technology,automotive technology
143,business management,business management
144,"Banking, Corporate, Finance, and Securities Law","Banking, Corporate, Finance, and Securities Law"
145,Criminal Justice/Safety Studies,Criminal Justice/Safety Studies
146,Diploma in Technology,Surface Coatings
147,Computer Science,Computer Science
148,"English , Art History","English Language and Literature, General"
149,Professional Title as Organizer of local tourism option wine tourism and husbandry tourism,Promotion of local tourism
150,Professional Title as Tourist Guide,Torism
151,Technical certificate of higher education in Hospitality and Catering alternately,Hospitality and Catering
152,Professional Bachelor degree diploma in greeting/welcome (Reception) Customer relationship users,Hospitality and Catering
153,Associate's degree,General Education
154,High School Diploma,General Education
155,Bachelor's degree in Computer Science,Computer Science
156,Associate's Degree in Economics,Economics
157,Master of Science (M.Sc.) in International Management,International Management
158,Bachelor of Applied Science (B.A.Sc.) Electronic Engineering,Electronic Engineering
159,Master of Science (M.Sc.) in Business Information Systems,Business Information Systems
160,Bachelor of Science (B.Sc.) in Business Information Technology,Business Information Technology
161,High School Diploma,General
162,Bachelor's degree in Chemical Biotechnology,Chemical Biotechnology
163,Bachelor's degree in Biology,"Biology, General"
164,Diploma in Information Technology,Computer and Information Sciences and Support Services
165,Bachelor of Science in Engineering,General Engineering
166,Associate of Arts - AA in History,History
167,Bachelor of Science - BS in Information Technology,Information Technology
168,Bachelor of Architecture - BArch Architecture,Architecture
169,Bachelor of Business Administration - BBA,Business Management (Human Resources) & Marketing (Advertising & Digital Media)
170,Psychology,Psychology
171,Psychology,Clinical Psychology
172,Application Developer in C#.NET Program,"Computer Programming, Specific Applications"
173,"BFA, MA of Fine Arts",Art
174,Bachelor of Commerce (B.Com.),Commerce
175,Diploma of Education,Education
176,Bachelor's degree in Interior Design,Bacehlor of Interior Design (Commercial)
177,Bachelor's degree in Interior Design,Design (Interior Design)
178,MA in Humanities,Human rights and illegal movement of refugees and asylum seekers.
179,Telecommunications Engineering (ECE),Telecommunications Engineering (ECE)
180,Bachelor of Engineering (B.E.),"Electrical, Electronics and Communications Engineering"
181,M.S. in Environmental Health Sciences,Environmental Health Sciences
182,B.S. in Biology,Biology
183,Bachelor's degree Public Health Education and Promotion ,Public Health Education and Promotion
184,Bachelor of Science in Commerce,Accounting
185,Chemistry,"Chemistry, Science"
186,BA (Hons) in Philosophy,Philosophy
187,A Levels,"Economics, English Literature, French, General Studies"
188,Commecial Administration,"Marketing/Marketing Management, General"
189,Bachelor's Degree in Arabic Language,"Arabic Language, Foreign Language"
190,Bachelor of Science - BS in Mechanical Engineering,Mechanical Engineering
191,Associate of Science - AS/Transfer Mathematics,Mechanical Engineering Related Technologies/Technicians
192,Master of Arts - MA in English Literature,literature
193,Bachelor of Arts - BA English Language and Literature,"English Language and Literature, General"
194,Bachelor's degree in Marine Sciences,Marine Sciences
195,Senior High School,Science
196,Master of Arts - MA in Human Resources Management,Human Resources Management and Services
197,Course Program Certification in Artificial Intelligence,Artificial Intelligence: Implications for Business Strategy
198,Bachelor in Psychology,Psychology
199,Bachelor in Economics,Economics
200,Master in Hospitality & Tourism Accommodation Management,Hospitality and Tourism Management
201,BB in Tourism,Hospitality and Tourism Management
202,Bachelor's degree in Tourism,Tourism
203,Bachelor of Engineering,Computer Science
204,Bachelor of Arts in History,"History, English"
205,Master of Business Administration (MBA),Finance
206,Bachelor of Accounting,Accounting
207,Bachelor of Accounting,accounting
208,Bachelor of Science in Business Administration,Science Business Administration
209,Business and Accounting,Business and Accounting
210,Associate of Arts in Business,Business
211,"Business/Commerce, General","Goods, Business, Commerce"
212,Bachelor of Science in Environmental Science,Agronomy & Environmental Science; Turfgrass Management
213,PhD in Immunology,"Immunology, Healthcare, Medical Sciences"
214,Master of Business Administration (MBA),Business Adminsitration
215,Master of Science (M.Sc.) in Organisation and Management,Organisation and Management
216,International Baccalaureate,"English Language and Literature, General"
217,Master of Business Administration - MBA,Business Administration
218,Doctor of Nursing Practice,Family Nurse Practitioner
219,Bachelor of Science - BS in Nursing,Nursing
220,Doctor of Pharmacy (Pharm.D.),"Pharmacy, Healthcare, Medical Sciences"
221,Bachelor's degree in Pharmaceutical Sciences,Pharmacy (Hons.)
222,Master's degree in Clinical Pharmacy,Clinical Pharmacy
223,"Bachelor's Degree Pharmacy, Pharmaceutical Sciences, and Administration","Pharmacy, Pharmaceutical Sciences, and Administration"
224,Associate's Degree in Economics Visual Merchandising,Visual Merchandising
225,High School,High School Certificate of Competence Program
226,Master's Degree in Business Informatics,Business Informatics
227,Bachelor's Degree in Business Administration,Business Administration
228,Bachelor of Technology (B.Tech.) in Information Technology,Information Technology
229,Bachelor of Applied Science (B.A.Sc.) in Human Resource,Human Resource Mgmt & Human Services
230,Certificate Program,Global Career Development Facilitator Certificate
231,Human Resource Certificate Program,HR Professional Certificate
232,BTEC Level 3 Business and Finance,Business and Finance
233,Bachelors of Arts in Social Sciences,Sociology
234,Bachelor of Technology (BTech) in Computer Science And Engineering,Computer Science And Engineering
235,High School,Science
236,Finance,Finance
237,B.Tech in Electronics & Communication Engineering,Electronics & Communication Engineering
238,Information Technology,Information Technology
239,"Administration, Public Policy","Administration, Public Policy"
240,Master Social Sciencs,Social
241,BA Social Sciences,Sociology
242,Bachelor of Arts Social Sciences,Sociology
243,Bachelor's Music,Music and Business
244,LLB,Law
245,Bachelor of Arts (B.A.) in America History,American/United States Studies/Civilization
246,Specialization in Procurement,Supply Chain
247,"Business Logistics, Supply Chain",Business Logistics
248,"International Trade, Business Logistics, Supply Chain",International Trade
249,Specialization in English Language,English
250,Diploma in Poetry,"English Poetry, Language Studies"
251,Music Production Software Certificate,Music Production Software Certificate
252,Bachelor of Arts (BA) in Photography,Photography
253,Associate of Arts (A.A.) in Liberal Arts and Sciences,"Liberal Arts and Sciences, General Studies and Humanities"
254,Early Childhood Education and Teaching,Education
255,Bachelor of Science - BS in Sports and Exercise,Sports and Exercise
256,Bachelor of Science (B.S.) Meteorology,Meteorology
257,Diploma of Landscape Design,Architecture
258,The Architectural Imagination,Architecture
259,Fellow Certified Practicing Marketer (FAMI CPM),Marketing
260,Certified Practising Marketer (CPM),Marketing
261,Leadership & Followship of Cross Functional & Cross Cultural Teams,Cultural Studies
262,Diploma of Marketing,Marketing
263,Diploma of Front Line Management,Management
264,RN & GradDip N (Perioperative & Anaesthesia),"Healthcare, Medical Sciences"
265,Bachelor of Science - BS Administrative Science and Technology,Administrative Science and Technology
266,Doctor of Philosophy - PhD Health Services,Health Services
267,Robert Wood Johnson Clinical Scholar,Health Services Research
268,Internal Medicine Residency Program,"Healthcare, Medical Sciences"
269,Doctor of Osteopathic Medicine DO,"Healthcare, Medical Sciences"
270,Bachelor of Arts - BA,Econometrics and Quantitative Economics
271,Executive MBA,Manage People and Innovation
272,Full Stack Web Development Certification,Computer Software Engineering
273,Civil Engineering,Civil Engineering
274,Civil Engineering,Civil Engineering
275,Master of Science (MS) Chemical Engineering Process Design,Chemical Engineering Process Design
276,Diploma of Education in Network Administration,MIS Network Administration with CompTIA
277,Bachelor of Science in Computer Information Systems,Computer Information Systems w/ minor in Management
278,Master of Business Administration (MBA),"Finance, General"
279,Master's degree in Biotechnology,Biotechnology
280,Bachelor's of Education,Secondary Education and Teaching
281,Associate of Arts (AA) in English Language,Religious Studies/English Language
282,Bachelor of Science in Nursing,Nursing
283,B.S. in Civil Engineering,Civil Engineering
284,Paralegalism,Legal Assistant/Paralegal
285,Industrial Engineering,Industrial Engineering
286,Waste & Management,"Industrial Engineering, Environmental Sciences"
287,Project Management,Project Management
288,CA-Final,Chartered Accountancy
289,Bachelor of Commerce - BCom,Accounting and Finance
290,Assoc. of Applied Science Welding Technologies,Welding Technologies
291,bachelor of Political Sciences,Political Sciences
292,Social Sciences,Social Sciences
293,Cinematic,Directing and Theatrical Production
294,Master of Education (M.Ed.),"Educational Leadership and Administration, General"
295,Bachelor's Degree Education,Education
296,Bachelor of Science (B.Sc.) Zoology,Zoology/Animal Biology
297,A-levels,Mathematics
298,Doctor of Philosophy (PhD) Finance,"Finance, General"
299,Doctor of Philosophy (PhD) Economics,Economics
300,Master of Engineering (MEng) Computer Science,Computer Science
301,Bachelor of Arts (BA) Business Administration and Management,"Business Administration and Management, General"
302,Business Analysis,Business Analysis
303,Bechelor Finance,Finance
304,Bachelor of Business Administration - BBA,Program Management
305,Business adminstration,"Business Administration and Management, General"
306,Ph.D Condensed Matter Physics,Physics
307,Bachelor of Science Mathematics and Physics,Mathematics and Physics
308,Master of Laws - LLM,commercial law
309,Bachelor of Laws - LLB,"Business/Commerce, General, Law"
310,M.S. Bioengineering,Bioengineering
311,Diploma in Engineering,Electrical
312,Bachelor of Business Administration - BBA,International Business
313,Bachelor of Business Administration (B.B.A.),International Marketing
314,M.Tech in Electronics & Communication Engineering with Specialization in Communication Engineering,Electronics and Communication Engineering
315,Bachelor's Degree Electronics and Communication Engineering,Electronics and Communication Engineering
316,"Bachelor's Degree, Architectural Technology",Architecture
317,"Bachelor's Degree, Civil Engineering",Civil Engineering
318,Diploma of Journalism,Journalism
319,Social Anthropology,Media Studies
320,Bachelor of Commerce,Computer Science
321,BA of Communications,Communications
322,Master of Business Administration (MBA),Business Administration
323,Surgical Technology/Technologist,Dentistry
324,A levels,"Mathematics, Music, Politics, Physics"
325,Associate's Degree Hospitality Management,Hospitality Administration/Management
326,Postgrade Certificate Intellectual Property Law,Intellectual Property Law
327,PhD in Mechanical Engineering,Engineering
328,Master of Science (MSc) Aeronautics,Aeronautics/Aviation/Aerospace Science and Technology
329,Bachelor of Engineering (BEng) Aeronautics,Aeronautics/Aviation/Aerospace Science and Technology
330,Master's degree Neuroscience,Integrative and Organismal Biology/Neuroscience
331,Bachelor of Science - BS Neurobiology and Behavior,Neurobiology and Behavior
332,Bachelor of Arts Cinema Studies and Media and Communications,Cinema Studies and Media and Communications
333,Diploma of Mass Communications,Mass Communications
334,Bachelor's degree Computer Science,Computer Science
335,Bachelor of Arts (B.A.) Japanese Studies,Japanese Studies
336,Bachelor of Arts - BA Japanese Studies,Japanese Studies
337,High School Diploma Information Technology,Information Technology
338,Construction Management,Construction Management
339,Master of Business Administration (M.B.A.),Health/Health Care Administration/Management
340,Advanced Nursing Practice,Advanced Nursing Practice
341,Nursing,Registered Nursing/Registered Nurse
342,Bachelor's Degree Sport Science,Excercise Science
343,"Bachelor of Technology - Btech Electrical, Electronics and Communications Engineering","Electrical, Electronics and Communications Engineering"
344,Master of Computer Applications (MCA),Information Technology
345,Bachelor of Computer Applications,Computer/Information Technology Administration and Management
346,Bachelor's Degree Management Information Systems,"Management Information Systems, General"
347,"Associate's degree Business Administration, Management and Operations","Business Administration, Management and Operations"
348,Graduated,General
349,Bachelor's in Accounting,Accounting
350,BS Manufacturing Engineering Technology,Manufacturing Engineering Technology
351,Master of Business Administration (M.B.A.),Master of Business Administration
352,Bachelor's Degree Information System Management,Information System Management
353,Post Graduate Certificate in Law,Law
354,Bachelor of Construction,Construction Management and Construction Economics
355,Computing Science,Computing Science
356,Business Administration,Business Administration
357,Advanced Diploma in Accounting,Accounting
358,Physics,Physics
359,Master's degree Human Resources Management and Services,Human Resources Management and Services
360,Bachelor of Science (B.S.) Hospitality Administration/Management,Hospitality Administration/Management
361,Master's degree Mechanical Engineering,Mechanical Engineering
362,Bachelor of Business Administration (B.B.A.),"Finance, General"
363,Master of Science - MS Mechanical Engineering,Mechanical Engineering (specialization in Automotive and Control Systems)
364,Bachelor of Technology (BTech) Mechanical Engineering,Mechanical Engineering
365,Master's degree Informatics,Informatics
366,Bachelor's Degree Communication,Communications
367,Accounting,Accounting
368,High school diploma,Basic Skills and Developmental/Remedial Education
369,AA in Art&Advertising Design & BAS in Communication Design,"Art&Advertising Design, Communication Design - Majors: Web, GraphicDesign, Desktop Publ."
370,Law Studies Diploma,"Family Law, Law Studies, Global Law, Computer Math"
371,Advertising,Advertising
372,German as a Foreign Language,Foreign Language
373,Associate's degree Communication,Communication
374,MSc Fire Safety Management,Fire Safety Management
375,Chemistry,Chemistry
376,Food & Bioressource Technology,Food Science
377,"Chemical Engineering, Operation & Environmental Technology","Chemical Engineering, Operation & Environmental Technology"
378,Bachelor of Science - BS Civil and Environmental Engineering,Civil and Environmental Engineering
379,Physical Sciences,Physical Sciences
380,Master of Business Administration,Entrepreneuring
381,Electrical Engineering EE and Computer Graphics,Electrical Engineering EE and Computer Graphics
382,B. Engineering Physics,Nuclear & Bio-Medical Engineering
383,Industrial Fellow,Entrepreneurship/Entrepreneurial Studies
384,MBA,Marketing
385,BBA,Marketing
386,F.Sc,Pre Engineering
387,S.Sc,"Bio, Chemistry, Maths, Physics"
388,BSc Hons,Combined Science (Mathematics with Computing)
389,Master of Business Administration - MBA,Marketing
390,Bachelors of Science in Business Administration,Integrated Business
391,B.S. Maritime Administration,Economics
392,Bachelor of Engineering (B.E.),Electrical Engineering/Computer Science
393,Business Management,Business Management
394,Bachelor of Fine Arts - BFA,Photojournalism
